{
  "schemaVersion": 1,
  "channel": "stable",
  "enabled": false,
  "version": "",
  "publishedAtUtc": "",
  "minimumUpdaterVersion": "1.0.0",
  "mandatory": false,
  "artifact": {
    "fileName": "ArenaBridge.exe",
    "url": "",
    "sha256": "",
    "sizeBytes": 0
  },
  "notes": [
    "Stable bleibt bis nach erfolgreichem Beta-Test und ausdruecklicher Freigabe deaktiviert. Keine Stable-EXE oder automatische Verteilung vorbereitet."
  ]
}
