{
  "schemaVersion": 1,
  "channel": "beta",
  "enabled": false,
  "version": "",
  "publishedAtUtc": "",
  "minimumUpdaterVersion": "1.0.0",
  "mandatory": false,
  "artifact": {
    "fileName": "ArenaBridge.exe",
    "url": "",
    "sha256": "",
    "sizeBytes": 0
  },
  "notes": [
    "Private local tests are not a public beta. Keep this channel disabled; the single local candidate lives at next-update/release/ArenaBridge.exe."
  ]
}
